<?xml version="1.0" encoding="UTF-8"?>

<rxeffex:regression xmlns:xsi="http://www.w3.org/2001/XMLSchema-instance" 	
	xmlns:rxeffex="http://rxeffex.com/test"	xsi:schemaLocation="http://rxeffex.com/test  http://rxeffex.com/rxeffex-test.xsd">

	<rxeffex:name>Rxeffex Regression Test</rxeffex:name>
	<rxeffex:runBy>wchuang</rxeffex:runBy>
	<rxeffex:outFileRoot>C:/TestOutput</rxeffex:outFileRoot>
	<rxeffex:scenarios>
		<rxeffex:scenario>
			<rxeffex:name>Rxeffex Home Page</rxeffex:name>			
			<rxeffex:browsers>
				<rxeffex:browser>firefox</rxeffex:browser>
			</rxeffex:browsers>	
			<rxeffex:testCases>

				<rxeffex:testCase>
					<rxeffex:name>Home Page</rxeffex:name>
					<rxeffex:url>https://rxeffex.com</rxeffex:url>
					<rxeffex:timeLimit>0</rxeffex:timeLimit>
					<rxeffex:expecteds>
						<rxeffex:expected>
							<rxeffex:operator>eq</rxeffex:operator>
							<rxeffex:fieldId>//*[@id="navbar"]/ul/li[1]/a</rxeffex:fieldId>
							<rxeffex:value>Home</rxeffex:value>
						</rxeffex:expected>
						<rxeffex:expected>
							<rxeffex:operator>eq</rxeffex:operator>
							<rxeffex:fieldId>//*[@id="navbar"]/ul/li[2]/a</rxeffex:fieldId>
							<rxeffex:value>Consumers</rxeffex:value>
						</rxeffex:expected>	
						<rxeffex:expected>
							<rxeffex:operator>eq</rxeffex:operator>
							<rxeffex:fieldId>//*[@id="rxEffexIndexpageCaousel"]/div/div/div/div/h1</rxeffex:fieldId>
							<rxeffex:value>Committed to transparency for adverse events</rxeffex:value>
						</rxeffex:expected>											
					</rxeffex:expecteds>					
				</rxeffex:testCase>
							
				<rxeffex:testCase>
					<rxeffex:name>Transition to Consumers Page</rxeffex:name>
					<rxeffex:url>https://rxeffex.com</rxeffex:url>
					<rxeffex:timeLimit>0</rxeffex:timeLimit>
					<rxeffex:inputs>				
						<rxeffex:input>
							<rxeffex:fieldId>//*[@id="navbar"]/ul/li[2]/a</rxeffex:fieldId>
							<rxeffex:action>click</rxeffex:action>
						</rxeffex:input>						
					</rxeffex:inputs>
					<rxeffex:expecteds>
						<rxeffex:expected>
							<rxeffex:operator>eq</rxeffex:operator>
							<rxeffex:fieldId>/html/body/div[2]/div[1]/div[2]/div/h2</rxeffex:fieldId>
							<rxeffex:value>Consumers</rxeffex:value>
						</rxeffex:expected>
					</rxeffex:expecteds>				
				</rxeffex:testCase>
								
				<rxeffex:testCase>
					<rxeffex:name>Adverse Event Query</rxeffex:name>
					<rxeffex:url>https://rxeffex.com/consumer.html</rxeffex:url>
					<rxeffex:timeLimit>0</rxeffex:timeLimit>
					<rxeffex:inputs>				
						<rxeffex:input>
							<rxeffex:fieldId>//*[@id="inputSearchCriteria"]</rxeffex:fieldId>
							<rxeffex:value>aspirin</rxeffex:value>
							<rxeffex:action>input</rxeffex:action>
						</rxeffex:input>
						<rxeffex:input>
							<rxeffex:fieldId>//*[@id="seriousSignificant"]</rxeffex:fieldId>
							<rxeffex:action>click</rxeffex:action>
						</rxeffex:input>
						<rxeffex:input>
							<rxeffex:fieldId>//*[@id="divOutcomes"]/ul/a[4]</rxeffex:fieldId>
							<rxeffex:action>click</rxeffex:action>
						</rxeffex:input>	
						<rxeffex:input>
							<rxeffex:fieldId>//*[@id="generateChartButton"]</rxeffex:fieldId>
							<rxeffex:action>click</rxeffex:action>
						</rxeffex:input>						
					</rxeffex:inputs>
					<rxeffex:expecteds>			
						<rxeffex:expected>
							<rxeffex:operator>eq</rxeffex:operator>
							<rxeffex:fieldId>/html/body/div[2]/div[2]/div[2]/div[2]/div/*[name()='svg']/*[name()='g']/*[name()='text']</rxeffex:fieldId>
							<rxeffex:value>702</rxeffex:value>
						</rxeffex:expected>
					</rxeffex:expecteds>				
				</rxeffex:testCase>	
																														
			</rxeffex:testCases>		
		</rxeffex:scenario>
	</rxeffex:scenarios>
</rxeffex:regression>